{
  "$id": "https://icon-svg-select.local/icon-policy.schema.json",
  "title": "Armorial Policy",
  "description": "Executable IconPark rendering and semantic-selection policy.",
  "$schema": "https://json-schema.org/draft/2020-12/schema",
  "type": "object",
  "properties": {
    "version": {
      "type": "number",
      "const": 1
    },
    "collections": {
      "minItems": 1,
      "maxItems": 1,
      "type": "array",
      "items": {
        "$ref": "#/$defs/__schema0"
      }
    },
    "defaults": {
      "type": "object",
      "properties": {
        "theme": {
          "$ref": "#/$defs/__schema1"
        },
        "size": {
          "type": "integer",
          "minimum": 8,
          "maximum": 512
        },
        "strokeWidth": {
          "type": "number",
          "minimum": 0.5,
          "maximum": 16,
          "description": "Final visible stroke width in rendered px."
        },
        "strokeLinecap": {
          "$ref": "#/$defs/__schema2"
        },
        "strokeLinejoin": {
          "$ref": "#/$defs/__schema3"
        },
        "colors": {
          "type": "object",
          "properties": {
            "primary": {
              "$ref": "#/$defs/__schema4"
            },
            "secondary": {
              "$ref": "#/$defs/__schema4"
            },
            "innerStroke": {
              "$ref": "#/$defs/__schema4"
            },
            "innerFill": {
              "$ref": "#/$defs/__schema4"
            }
          },
          "required": [
            "primary",
            "secondary",
            "innerStroke",
            "innerFill"
          ],
          "additionalProperties": false
        }
      },
      "required": [
        "theme",
        "size",
        "strokeWidth",
        "strokeLinecap",
        "strokeLinejoin",
        "colors"
      ],
      "additionalProperties": false
    },
    "contexts": {
      "type": "object",
      "propertyNames": {
        "$ref": "#/$defs/__schema5"
      },
      "additionalProperties": {
        "$ref": "#/$defs/__schema6"
      },
      "maxProperties": 32
    },
    "selections": {
      "type": "object",
      "propertyNames": {
        "$ref": "#/$defs/__schema7"
      },
      "additionalProperties": {
        "$ref": "#/$defs/__schema8"
      },
      "maxProperties": 256
    }
  },
  "required": [
    "version",
    "collections",
    "defaults",
    "contexts",
    "selections"
  ],
  "additionalProperties": false,
  "$defs": {
    "__schema0": {
      "type": "string",
      "const": "icon-park"
    },
    "__schema1": {
      "type": "string",
      "enum": [
        "outline",
        "filled",
        "two-tone",
        "multi-color"
      ]
    },
    "__schema2": {
      "type": "string",
      "enum": [
        "butt",
        "round",
        "square"
      ]
    },
    "__schema3": {
      "type": "string",
      "enum": [
        "miter",
        "round",
        "bevel"
      ]
    },
    "__schema4": {
      "anyOf": [
        {
          "type": "string",
          "maxLength": 64,
          "pattern": "^#(?:[0-9a-fA-F]{3}|[0-9a-fA-F]{4}|[0-9a-fA-F]{6}|[0-9a-fA-F]{8})$"
        },
        {
          "type": "string",
          "maxLength": 64,
          "pattern": "^var\\(--[a-zA-Z0-9_-]+\\)$"
        },
        {
          "type": "string",
          "enum": [
            "currentColor",
            "none",
            "transparent",
            "aliceblue",
            "antiquewhite",
            "aqua",
            "aquamarine",
            "azure",
            "beige",
            "bisque",
            "black",
            "blanchedalmond",
            "blue",
            "blueviolet",
            "brown",
            "burlywood",
            "cadetblue",
            "chartreuse",
            "chocolate",
            "coral",
            "cornflowerblue",
            "cornsilk",
            "crimson",
            "cyan",
            "darkblue",
            "darkcyan",
            "darkgoldenrod",
            "darkgray",
            "darkgreen",
            "darkgrey",
            "darkkhaki",
            "darkmagenta",
            "darkolivegreen",
            "darkorange",
            "darkorchid",
            "darkred",
            "darksalmon",
            "darkseagreen",
            "darkslateblue",
            "darkslategray",
            "darkslategrey",
            "darkturquoise",
            "darkviolet",
            "deeppink",
            "deepskyblue",
            "dimgray",
            "dimgrey",
            "dodgerblue",
            "firebrick",
            "floralwhite",
            "forestgreen",
            "fuchsia",
            "gainsboro",
            "ghostwhite",
            "gold",
            "goldenrod",
            "gray",
            "green",
            "greenyellow",
            "grey",
            "honeydew",
            "hotpink",
            "indianred",
            "indigo",
            "ivory",
            "khaki",
            "lavender",
            "lavenderblush",
            "lawngreen",
            "lemonchiffon",
            "lightblue",
            "lightcoral",
            "lightcyan",
            "lightgoldenrodyellow",
            "lightgray",
            "lightgreen",
            "lightgrey",
            "lightpink",
            "lightsalmon",
            "lightseagreen",
            "lightskyblue",
            "lightslategray",
            "lightslategrey",
            "lightsteelblue",
            "lightyellow",
            "lime",
            "limegreen",
            "linen",
            "magenta",
            "maroon",
            "mediumaquamarine",
            "mediumblue",
            "mediumorchid",
            "mediumpurple",
            "mediumseagreen",
            "mediumslateblue",
            "mediumspringgreen",
            "mediumturquoise",
            "mediumvioletred",
            "midnightblue",
            "mintcream",
            "mistyrose",
            "moccasin",
            "navajowhite",
            "navy",
            "oldlace",
            "olive",
            "olivedrab",
            "orange",
            "orangered",
            "orchid",
            "palegoldenrod",
            "palegreen",
            "paleturquoise",
            "palevioletred",
            "papayawhip",
            "peachpuff",
            "peru",
            "pink",
            "plum",
            "powderblue",
            "purple",
            "rebeccapurple",
            "red",
            "rosybrown",
            "royalblue",
            "saddlebrown",
            "salmon",
            "sandybrown",
            "seagreen",
            "seashell",
            "sienna",
            "silver",
            "skyblue",
            "slateblue",
            "slategray",
            "slategrey",
            "snow",
            "springgreen",
            "steelblue",
            "tan",
            "teal",
            "thistle",
            "tomato",
            "turquoise",
            "violet",
            "wheat",
            "white",
            "whitesmoke",
            "yellow",
            "yellowgreen"
          ]
        },
        {
          "type": "string",
          "maxLength": 64,
          "pattern": "^(?:[cC][uU][rR][rR][eE][nN][tT][cC][oO][lL][oO][rR]|[nN][oO][nN][eE]|[tT][rR][aA][nN][sS][pP][aA][rR][eE][nN][tT]|[aA][lL][iI][cC][eE][bB][lL][uU][eE]|[aA][nN][tT][iI][qQ][uU][eE][wW][hH][iI][tT][eE]|[aA][qQ][uU][aA]|[aA][qQ][uU][aA][mM][aA][rR][iI][nN][eE]|[aA][zZ][uU][rR][eE]|[bB][eE][iI][gG][eE]|[bB][iI][sS][qQ][uU][eE]|[bB][lL][aA][cC][kK]|[bB][lL][aA][nN][cC][hH][eE][dD][aA][lL][mM][oO][nN][dD]|[bB][lL][uU][eE]|[bB][lL][uU][eE][vV][iI][oO][lL][eE][tT]|[bB][rR][oO][wW][nN]|[bB][uU][rR][lL][yY][wW][oO][oO][dD]|[cC][aA][dD][eE][tT][bB][lL][uU][eE]|[cC][hH][aA][rR][tT][rR][eE][uU][sS][eE]|[cC][hH][oO][cC][oO][lL][aA][tT][eE]|[cC][oO][rR][aA][lL]|[cC][oO][rR][nN][fF][lL][oO][wW][eE][rR][bB][lL][uU][eE]|[cC][oO][rR][nN][sS][iI][lL][kK]|[cC][rR][iI][mM][sS][oO][nN]|[cC][yY][aA][nN]|[dD][aA][rR][kK][bB][lL][uU][eE]|[dD][aA][rR][kK][cC][yY][aA][nN]|[dD][aA][rR][kK][gG][oO][lL][dD][eE][nN][rR][oO][dD]|[dD][aA][rR][kK][gG][rR][aA][yY]|[dD][aA][rR][kK][gG][rR][eE][eE][nN]|[dD][aA][rR][kK][gG][rR][eE][yY]|[dD][aA][rR][kK][kK][hH][aA][kK][iI]|[dD][aA][rR][kK][mM][aA][gG][eE][nN][tT][aA]|[dD][aA][rR][kK][oO][lL][iI][vV][eE][gG][rR][eE][eE][nN]|[dD][aA][rR][kK][oO][rR][aA][nN][gG][eE]|[dD][aA][rR][kK][oO][rR][cC][hH][iI][dD]|[dD][aA][rR][kK][rR][eE][dD]|[dD][aA][rR][kK][sS][aA][lL][mM][oO][nN]|[dD][aA][rR][kK][sS][eE][aA][gG][rR][eE][eE][nN]|[dD][aA][rR][kK][sS][lL][aA][tT][eE][bB][lL][uU][eE]|[dD][aA][rR][kK][sS][lL][aA][tT][eE][gG][rR][aA][yY]|[dD][aA][rR][kK][sS][lL][aA][tT][eE][gG][rR][eE][yY]|[dD][aA][rR][kK][tT][uU][rR][qQ][uU][oO][iI][sS][eE]|[dD][aA][rR][kK][vV][iI][oO][lL][eE][tT]|[dD][eE][eE][pP][pP][iI][nN][kK]|[dD][eE][eE][pP][sS][kK][yY][bB][lL][uU][eE]|[dD][iI][mM][gG][rR][aA][yY]|[dD][iI][mM][gG][rR][eE][yY]|[dD][oO][dD][gG][eE][rR][bB][lL][uU][eE]|[fF][iI][rR][eE][bB][rR][iI][cC][kK]|[fF][lL][oO][rR][aA][lL][wW][hH][iI][tT][eE]|[fF][oO][rR][eE][sS][tT][gG][rR][eE][eE][nN]|[fF][uU][cC][hH][sS][iI][aA]|[gG][aA][iI][nN][sS][bB][oO][rR][oO]|[gG][hH][oO][sS][tT][wW][hH][iI][tT][eE]|[gG][oO][lL][dD]|[gG][oO][lL][dD][eE][nN][rR][oO][dD]|[gG][rR][aA][yY]|[gG][rR][eE][eE][nN]|[gG][rR][eE][eE][nN][yY][eE][lL][lL][oO][wW]|[gG][rR][eE][yY]|[hH][oO][nN][eE][yY][dD][eE][wW]|[hH][oO][tT][pP][iI][nN][kK]|[iI][nN][dD][iI][aA][nN][rR][eE][dD]|[iI][nN][dD][iI][gG][oO]|[iI][vV][oO][rR][yY]|[kK][hH][aA][kK][iI]|[lL][aA][vV][eE][nN][dD][eE][rR]|[lL][aA][vV][eE][nN][dD][eE][rR][bB][lL][uU][sS][hH]|[lL][aA][wW][nN][gG][rR][eE][eE][nN]|[lL][eE][mM][oO][nN][cC][hH][iI][fF][fF][oO][nN]|[lL][iI][gG][hH][tT][bB][lL][uU][eE]|[lL][iI][gG][hH][tT][cC][oO][rR][aA][lL]|[lL][iI][gG][hH][tT][cC][yY][aA][nN]|[lL][iI][gG][hH][tT][gG][oO][lL][dD][eE][nN][rR][oO][dD][yY][eE][lL][lL][oO][wW]|[lL][iI][gG][hH][tT][gG][rR][aA][yY]|[lL][iI][gG][hH][tT][gG][rR][eE][eE][nN]|[lL][iI][gG][hH][tT][gG][rR][eE][yY]|[lL][iI][gG][hH][tT][pP][iI][nN][kK]|[lL][iI][gG][hH][tT][sS][aA][lL][mM][oO][nN]|[lL][iI][gG][hH][tT][sS][eE][aA][gG][rR][eE][eE][nN]|[lL][iI][gG][hH][tT][sS][kK][yY][bB][lL][uU][eE]|[lL][iI][gG][hH][tT][sS][lL][aA][tT][eE][gG][rR][aA][yY]|[lL][iI][gG][hH][tT][sS][lL][aA][tT][eE][gG][rR][eE][yY]|[lL][iI][gG][hH][tT][sS][tT][eE][eE][lL][bB][lL][uU][eE]|[lL][iI][gG][hH][tT][yY][eE][lL][lL][oO][wW]|[lL][iI][mM][eE]|[lL][iI][mM][eE][gG][rR][eE][eE][nN]|[lL][iI][nN][eE][nN]|[mM][aA][gG][eE][nN][tT][aA]|[mM][aA][rR][oO][oO][nN]|[mM][eE][dD][iI][uU][mM][aA][qQ][uU][aA][mM][aA][rR][iI][nN][eE]|[mM][eE][dD][iI][uU][mM][bB][lL][uU][eE]|[mM][eE][dD][iI][uU][mM][oO][rR][cC][hH][iI][dD]|[mM][eE][dD][iI][uU][mM][pP][uU][rR][pP][lL][eE]|[mM][eE][dD][iI][uU][mM][sS][eE][aA][gG][rR][eE][eE][nN]|[mM][eE][dD][iI][uU][mM][sS][lL][aA][tT][eE][bB][lL][uU][eE]|[mM][eE][dD][iI][uU][mM][sS][pP][rR][iI][nN][gG][gG][rR][eE][eE][nN]|[mM][eE][dD][iI][uU][mM][tT][uU][rR][qQ][uU][oO][iI][sS][eE]|[mM][eE][dD][iI][uU][mM][vV][iI][oO][lL][eE][tT][rR][eE][dD]|[mM][iI][dD][nN][iI][gG][hH][tT][bB][lL][uU][eE]|[mM][iI][nN][tT][cC][rR][eE][aA][mM]|[mM][iI][sS][tT][yY][rR][oO][sS][eE]|[mM][oO][cC][cC][aA][sS][iI][nN]|[nN][aA][vV][aA][jJ][oO][wW][hH][iI][tT][eE]|[nN][aA][vV][yY]|[oO][lL][dD][lL][aA][cC][eE]|[oO][lL][iI][vV][eE]|[oO][lL][iI][vV][eE][dD][rR][aA][bB]|[oO][rR][aA][nN][gG][eE]|[oO][rR][aA][nN][gG][eE][rR][eE][dD]|[oO][rR][cC][hH][iI][dD]|[pP][aA][lL][eE][gG][oO][lL][dD][eE][nN][rR][oO][dD]|[pP][aA][lL][eE][gG][rR][eE][eE][nN]|[pP][aA][lL][eE][tT][uU][rR][qQ][uU][oO][iI][sS][eE]|[pP][aA][lL][eE][vV][iI][oO][lL][eE][tT][rR][eE][dD]|[pP][aA][pP][aA][yY][aA][wW][hH][iI][pP]|[pP][eE][aA][cC][hH][pP][uU][fF][fF]|[pP][eE][rR][uU]|[pP][iI][nN][kK]|[pP][lL][uU][mM]|[pP][oO][wW][dD][eE][rR][bB][lL][uU][eE]|[pP][uU][rR][pP][lL][eE]|[rR][eE][bB][eE][cC][cC][aA][pP][uU][rR][pP][lL][eE]|[rR][eE][dD]|[rR][oO][sS][yY][bB][rR][oO][wW][nN]|[rR][oO][yY][aA][lL][bB][lL][uU][eE]|[sS][aA][dD][dD][lL][eE][bB][rR][oO][wW][nN]|[sS][aA][lL][mM][oO][nN]|[sS][aA][nN][dD][yY][bB][rR][oO][wW][nN]|[sS][eE][aA][gG][rR][eE][eE][nN]|[sS][eE][aA][sS][hH][eE][lL][lL]|[sS][iI][eE][nN][nN][aA]|[sS][iI][lL][vV][eE][rR]|[sS][kK][yY][bB][lL][uU][eE]|[sS][lL][aA][tT][eE][bB][lL][uU][eE]|[sS][lL][aA][tT][eE][gG][rR][aA][yY]|[sS][lL][aA][tT][eE][gG][rR][eE][yY]|[sS][nN][oO][wW]|[sS][pP][rR][iI][nN][gG][gG][rR][eE][eE][nN]|[sS][tT][eE][eE][lL][bB][lL][uU][eE]|[tT][aA][nN]|[tT][eE][aA][lL]|[tT][hH][iI][sS][tT][lL][eE]|[tT][oO][mM][aA][tT][oO]|[tT][uU][rR][qQ][uU][oO][iI][sS][eE]|[vV][iI][oO][lL][eE][tT]|[wW][hH][eE][aA][tT]|[wW][hH][iI][tT][eE]|[wW][hH][iI][tT][eE][sS][mM][oO][kK][eE]|[yY][eE][lL][lL][oO][wW]|[yY][eE][lL][lL][oO][wW][gG][rR][eE][eE][nN])$"
        }
      ]
    },
    "__schema5": {
      "type": "string",
      "pattern": "^[a-zA-Z0-9][a-zA-Z0-9_-]{0,39}$"
    },
    "__schema6": {
      "type": "object",
      "properties": {
        "theme": {
          "$ref": "#/$defs/__schema1"
        },
        "size": {
          "type": "integer",
          "minimum": 8,
          "maximum": 512
        },
        "strokeWidth": {
          "type": "number",
          "minimum": 0.5,
          "maximum": 16,
          "description": "Final visible stroke width in rendered px."
        },
        "strokeLinecap": {
          "$ref": "#/$defs/__schema2"
        },
        "strokeLinejoin": {
          "$ref": "#/$defs/__schema3"
        },
        "colors": {
          "type": "object",
          "properties": {
            "primary": {
              "$ref": "#/$defs/__schema4"
            },
            "secondary": {
              "$ref": "#/$defs/__schema4"
            },
            "innerStroke": {
              "$ref": "#/$defs/__schema4"
            },
            "innerFill": {
              "$ref": "#/$defs/__schema4"
            }
          },
          "additionalProperties": false
        }
      },
      "additionalProperties": false
    },
    "__schema7": {
      "type": "string",
      "minLength": 1,
      "maxLength": 80
    },
    "__schema8": {
      "type": "string",
      "maxLength": 96,
      "pattern": "^(?:icon-park:)?[a-z0-9]+(?:-[a-z0-9]+)*$"
    }
  }
}
